{
  "schema": "epsm.scene/1",
  "units": "m",
  "up_axis": "Z",
  "objects": [
    {
      "id": "main_main_0_ceiling_contact_0_1_0",
      "name": "main_main_0_ceiling_contact_0_1_0",
      "kind": "surface",
      "parent": null,
      "vertices": [
        [
          0.0,
          0.0,
          3.0
        ],
        [
          12.0,
          0.0,
          3.0
        ],
        [
          12.0,
          8.0,
          3.0
        ],
        [
          0.0,
          8.0,
          3.0
        ]
      ],
      "holes": [],
      "normal": [
        0.0,
        0.0,
        1.0
      ],
      "area_m2": 96.0,
      "net_area_m2": 96.0,
      "metadata": {
        "part_id": "main",
        "facade_id": "",
        "storey": 0,
        "zone": "main_main_0",
        "area_m2": 96.0,
        "annotations": [
          "assumed height"
        ]
      },
      "boundary": "Surface",
      "zone": "main_main_0",
      "construction_name": "intermediate_floor_reverse",
      "layers": [],
      "construction_report": {},
      "epjson": {
        "vertices": [
          {
            "vertex_x_coordinate": 0.0,
            "vertex_y_coordinate": 0.0,
            "vertex_z_coordinate": 3.0
          },
          {
            "vertex_x_coordinate": 12.0,
            "vertex_y_coordinate": 0.0,
            "vertex_z_coordinate": 3.0
          },
          {
            "vertex_x_coordinate": 12.0,
            "vertex_y_coordinate": 8.0,
            "vertex_z_coordinate": 3.0
          },
          {
            "vertex_x_coordinate": 0.0,
            "vertex_y_coordinate": 8.0,
            "vertex_z_coordinate": 3.0
          }
        ],
        "zone_name": "main_main_0",
        "surface_type": "Ceiling",
        "construction_name": "intermediate_floor_reverse",
        "outside_boundary_condition": "Surface",
        "outside_boundary_condition_object": "main_main_1_floor_contact_0_1_0"
      }
    },
    {
      "id": "main_main_1_floor_contact_0_1_0",
      "name": "main_main_1_floor_contact_0_1_0",
      "kind": "surface",
      "parent": null,
      "vertices": [
        [
          0.0,
          8.0,
          3.0
        ],
        [
          12.0,
          8.0,
          3.0
        ],
        [
          12.0,
          0.0,
          3.0
        ],
        [
          0.0,
          0.0,
          3.0
        ]
      ],
      "holes": [],
      "normal": [
        0.0,
        0.0,
        -1.0
      ],
      "area_m2": 96.0,
      "net_area_m2": 96.0,
      "metadata": {
        "part_id": "main",
        "facade_id": "",
        "storey": 1,
        "zone": "main_main_1",
        "area_m2": 96.0,
        "annotations": [
          "assumed height"
        ]
      },
      "boundary": "Surface",
      "zone": "main_main_1",
      "construction_name": "intermediate_floor",
      "layers": [],
      "construction_report": {},
      "epjson": {
        "vertices": [
          {
            "vertex_x_coordinate": 0.0,
            "vertex_y_coordinate": 8.0,
            "vertex_z_coordinate": 3.0
          },
          {
            "vertex_x_coordinate": 12.0,
            "vertex_y_coordinate": 8.0,
            "vertex_z_coordinate": 3.0
          },
          {
            "vertex_x_coordinate": 12.0,
            "vertex_y_coordinate": 0.0,
            "vertex_z_coordinate": 3.0
          },
          {
            "vertex_x_coordinate": 0.0,
            "vertex_y_coordinate": 0.0,
            "vertex_z_coordinate": 3.0
          }
        ],
        "zone_name": "main_main_1",
        "surface_type": "Floor",
        "construction_name": "intermediate_floor",
        "outside_boundary_condition": "Surface",
        "outside_boundary_condition_object": "main_main_0_ceiling_contact_0_1_0"
      }
    },
    {
      "id": "main_main_0_floor_0",
      "name": "main_main_0_floor_0",
      "kind": "surface",
      "parent": null,
      "vertices": [
        [
          12.0,
          8.0,
          0.0
        ],
        [
          12.0,
          0.0,
          0.0
        ],
        [
          0.0,
          0.0,
          0.0
        ],
        [
          0.0,
          8.0,
          0.0
        ]
      ],
      "holes": [],
      "normal": [
        0.0,
        0.0,
        -1.0
      ],
      "area_m2": 96.0,
      "net_area_m2": 96.0,
      "metadata": {
        "part_id": "main",
        "facade_id": "",
        "storey": 0,
        "zone": "main_main_0",
        "area_m2": 96.0,
        "annotations": [
          "assumed height"
        ]
      },
      "boundary": "Ground",
      "zone": "main_main_0",
      "construction_name": "ground",
      "layers": [],
      "construction_report": {},
      "epjson": {
        "vertices": [
          {
            "vertex_x_coordinate": 12.0,
            "vertex_y_coordinate": 8.0,
            "vertex_z_coordinate": 0.0
          },
          {
            "vertex_x_coordinate": 12.0,
            "vertex_y_coordinate": 0.0,
            "vertex_z_coordinate": 0.0
          },
          {
            "vertex_x_coordinate": 0.0,
            "vertex_y_coordinate": 0.0,
            "vertex_z_coordinate": 0.0
          },
          {
            "vertex_x_coordinate": 0.0,
            "vertex_y_coordinate": 8.0,
            "vertex_z_coordinate": 0.0
          }
        ],
        "zone_name": "main_main_0",
        "surface_type": "Floor",
        "construction_name": "ground",
        "outside_boundary_condition": "Ground",
        "outside_boundary_condition_object": ""
      }
    },
    {
      "id": "main_main_0_wall_0_s0_z0",
      "name": "main_main_0_wall_0_s0_z0",
      "kind": "surface",
      "parent": null,
      "vertices": [
        [
          0.0,
          0.0,
          0.0
        ],
        [
          12.0,
          0.0,
          0.0
        ],
        [
          12.0,
          0.0,
          3.0
        ],
        [
          0.0,
          0.0,
          3.0
        ]
      ],
      "holes": [],
      "normal": [
        0.0,
        -1.0,
        0.0
      ],
      "area_m2": 36.0,
      "net_area_m2": 36.0,
      "metadata": {
        "part_id": "main",
        "facade_id": "main.r0.e0",
        "storey": 0,
        "zone": "main_main_0",
        "area_m2": 36.0,
        "annotations": [
          "assumed height"
        ]
      },
      "boundary": "Outdoors",
      "zone": "main_main_0",
      "construction_name": "wall",
      "layers": [],
      "construction_report": {},
      "epjson": {
        "vertices": [
          {
            "vertex_x_coordinate": 0.0,
            "vertex_y_coordinate": 0.0,
            "vertex_z_coordinate": 0.0
          },
          {
            "vertex_x_coordinate": 12.0,
            "vertex_y_coordinate": 0.0,
            "vertex_z_coordinate": 0.0
          },
          {
            "vertex_x_coordinate": 12.0,
            "vertex_y_coordinate": 0.0,
            "vertex_z_coordinate": 3.0
          },
          {
            "vertex_x_coordinate": 0.0,
            "vertex_y_coordinate": 0.0,
            "vertex_z_coordinate": 3.0
          }
        ],
        "zone_name": "main_main_0",
        "surface_type": "Wall",
        "construction_name": "wall",
        "outside_boundary_condition": "Outdoors",
        "outside_boundary_condition_object": ""
      }
    },
    {
      "id": "main_main_0_wall_1_s0_z0",
      "name": "main_main_0_wall_1_s0_z0",
      "kind": "surface",
      "parent": null,
      "vertices": [
        [
          12.0,
          0.0,
          0.0
        ],
        [
          12.0,
          8.0,
          0.0
        ],
        [
          12.0,
          8.0,
          3.0
        ],
        [
          12.0,
          0.0,
          3.0
        ]
      ],
      "holes": [],
      "normal": [
        1.0,
        0.0,
        0.0
      ],
      "area_m2": 24.0,
      "net_area_m2": 24.0,
      "metadata": {
        "part_id": "main",
        "facade_id": "main.r0.e1",
        "storey": 0,
        "zone": "main_main_0",
        "area_m2": 24.0,
        "annotations": [
          "assumed height"
        ]
      },
      "boundary": "Outdoors",
      "zone": "main_main_0",
      "construction_name": "wall",
      "layers": [],
      "construction_report": {},
      "epjson": {
        "vertices": [
          {
            "vertex_x_coordinate": 12.0,
            "vertex_y_coordinate": 0.0,
            "vertex_z_coordinate": 0.0
          },
          {
            "vertex_x_coordinate": 12.0,
            "vertex_y_coordinate": 8.0,
            "vertex_z_coordinate": 0.0
          },
          {
            "vertex_x_coordinate": 12.0,
            "vertex_y_coordinate": 8.0,
            "vertex_z_coordinate": 3.0
          },
          {
            "vertex_x_coordinate": 12.0,
            "vertex_y_coordinate": 0.0,
            "vertex_z_coordinate": 3.0
          }
        ],
        "zone_name": "main_main_0",
        "surface_type": "Wall",
        "construction_name": "wall",
        "outside_boundary_condition": "Outdoors",
        "outside_boundary_condition_object": ""
      }
    },
    {
      "id": "main_main_0_wall_2_s0_z0",
      "name": "main_main_0_wall_2_s0_z0",
      "kind": "surface",
      "parent": null,
      "vertices": [
        [
          12.0,
          8.0,
          0.0
        ],
        [
          0.0,
          8.0,
          0.0
        ],
        [
          0.0,
          8.0,
          3.0
        ],
        [
          12.0,
          8.0,
          3.0
        ]
      ],
      "holes": [],
      "normal": [
        0.0,
        1.0,
        0.0
      ],
      "area_m2": 36.0,
      "net_area_m2": 36.0,
      "metadata": {
        "part_id": "main",
        "facade_id": "main.r0.e2",
        "storey": 0,
        "zone": "main_main_0",
        "area_m2": 36.0,
        "annotations": [
          "assumed height"
        ]
      },
      "boundary": "Outdoors",
      "zone": "main_main_0",